categoria,cat_principal,nombre,ean,precio,precio_texto,fecha
Almacen,Almacen,3ds queso x 85 gr.,7790310985830,3649.0,"$3.649,00",20260630
Almacen,Almacen,3ds queso x143gr.,7790310985137,5118.0,"$5.118,00",20260630
Almacen,Almacen,3ds sabor queso x 43 gm,7790310985113,2271.0,"$2.271,00",20260630
Almacen,Almacen,ac. de oliva zuccardi x 500 ml coratina,7791728246629,24261.0,"$24.261,00",20260630
Almacen,Almacen,ac.de coco entrenuts x200virg.,763571722428,9649.0,"$9.649,00",20260630
Almacen,Almacen,ac.ol.l.toscana x250ml.ajo,7798080520657,9903.0,"$9.903,00",20260630
Almacen,Almacen,ac.ol.l.toscana x250ml.albahac,7798080520534,9903.0,"$9.903,00",20260630
Almacen,Almacen,ac.ol.zuccardi x250ml.coratina,7791728246612,14152.0,"$14.152,00",20260630
Almacen,Almacen,ac.ol.zuccardi x250ml.picual,7791728246575,14152.0,"$14.152,00",20260630
Almacen,Almacen,ac.ol.zuelo x500ml.bot.intenso,7791728241181,18903.0,"$18.903,00",20260630
Almacen,Almacen,acaitunas goya x 149 gm con pimiento picante,41331014922,9280.0,"$9.280,00",20260630
Almacen,Almacen,aceite cocinero mezcla x1.5lt.,7790070225023,5489.0,"$5.489,00",20260630
Almacen,Almacen,aceite cocinero puro de oliva x 500 ml,7790070265142,10919.0,"$10.919,00",20260630
Almacen,Almacen,aceite cocinero x900 ml oliva y girasol,7790070231598,5809.0,"$5.809,00",20260630
Almacen,Almacen,aceite copisi x 900 ml. girasol y oliva,7790272006819,6162.0,"$6.162,00",20260630
Almacen,Almacen,aceite de coco entrenuts neutro x 360 ml.,656750783931,8902.0,"$8.902,00",20260630
Almacen,Almacen,aceite de coco entrenuts virgen x 360 ml.,763571722435,16512.0,"$16.512,00",20260630
Almacen,Almacen,aceite de girasol alsamar x 5 lts.,7794870000040,21090.0,"$21.090,00",20260630
Almacen,Almacen,aceite de girasol alsamar x 900 ml.,7798316700907,3862.0,"$3.862,00",20260630
Almacen,Almacen,"aceite de girasol cocinero x 1,5 lt.",7790060023684,6909.0,"$6.909,00",20260630
Almacen,Almacen,aceite de girasol cocinero x 900 ml.,7790070012050,4359.0,"$4.359,00",20260630
Almacen,Almacen,"aceite de girasol legitimo x 1,5 lt.",7798316700815,6251.0,"$6.251,00",20260630
Almacen,Almacen,aceite de girasol legitimo x 3 lt.,7798316700822,12773.0,"$12.773,00",20260630
Almacen,Almacen,aceite de girasol legitimo x 5 lts.,7798316700839,21090.0,"$21.090,00",20260630
Almacen,Almacen,aceite de girasol legitimo x 900 ml.,7798316700808,3862.0,"$3.862,00",20260630
Almacen,Almacen,"aceite de girasol natura x 1,5 lt.",7790272001029,5999.0,"$5.999,00",20260630
Almacen,Almacen,aceite de girasol natura x 3 lt.,7790272001036,13775.0,"$13.775,00",20260630
Almacen,Almacen,aceite de girasol natura x 900 ml.,7790272001005,3799.0,"$3.799,00",20260630
Almacen,Almacen,aceite de maiz mazola x 900 ml.,7790272000794,5565.0,"$5.565,00",20260630
Almacen,Almacen,aceite de oliva  zuelo x 950 ml lata original,7791728248708,33106.0,"$33.106,00",20260630
Almacen,Almacen,aceite de oliva casalta extra virgen medio x 250 .,7790139004828,20223.0,"$20.223,00",20260630
Almacen,Almacen,aceite de oliva casalta extra virgen suave x 400 .,7790139004569,31043.0,"$31.043,00",20260630
Almacen,Almacen,aceite de oliva casalta medio x 400 ml.,7790139004576,31043.0,"$31.043,00",20260630
Almacen,Almacen,aceite de oliva cocinero extra virgen x 500 ml.,7790070265098,12905.0,"$12.905,00",20260630
Almacen,Almacen,aceite de oliva con limon la toscana x 250 ml.,7798080521265,9903.0,"$9.903,00",20260630
Almacen,Almacen,aceite de oliva copcinero extra virgen x 250 ml,7790070265104,7085.7,"$7.085,70",20260630
Almacen,Almacen,"aceite de oliva cortijo extra virgen x 1,5 lts.",7798123974812,49248.0,"$49.248,00",20260630
Almacen,Almacen,aceite de oliva cortijo x 250 ml.,7798123971385,11856.0,"$11.856,00",20260630
Almacen,Almacen,aceite de oliva extra virgen cocinero x 500 ml. su,7790070231871,12929.0,"$12.929,00",20260630
Almacen,Almacen,aceite de oliva extra virgen lira x 500 ml.,7790070231833,13859.0,"$13.859,00",20260630
Almacen,Almacen,aceite de oliva extra virgen nucete x 500 ml.,7792070001614,17479.0,"$17.479,00",20260630
Almacen,Almacen,aceite de oliva extra virgen viridian x 250 gm intenso,763571807323,14474.0,"$14.474,00",20260630
Almacen,Almacen,aceite de oliva extra virgen viridian x 500 ml clasica,40232789663,20795.0,"$20.795,00",20260630
Almacen,Almacen,aceite de oliva familia zuccardi x 250 ml. varieda,7791728246650,19207.0,"$19.207,00",20260630
Almacen,Almacen,aceite de oliva lira extra virgen cl sico x 500 m.,7790070265203,15160.0,"$15.160,00",20260630
Almacen,Almacen,aceite de oliva natura andino x 500 ml.,7790272008387,19478.0,"$19.478,00",20260630
Almacen,Almacen,aceite de oliva natura fuerte x 500 ml.,7790272008417,15900.0,"$15.900,00",20260630
Almacen,Almacen,aceite de oliva natura suave x 500 ml.,7790272008394,15900.0,"$15.900,00",20260630
Almacen,Almacen,aceite de oliva nucete clasico extra virgen x 250.,7792070001652,9918.0,"$9.918,00",20260630
Almacen,Almacen,aceite de oliva pignani clasico x 500 ml vidrio,7798089050254,14514.0,"$14.514,00",20260630
Almacen,Almacen,aceite de oliva pignani premium x 500 ml,7798183790063,19214.0,"$19.214,00",20260630
Almacen,Almacen,aceite de oliva zuccardi x 250 gm genovesa,7791728246537,14152.0,"$14.152,00",20260630
Almacen,Almacen,aceite de oliva zuccardi x 500 gm picual,7791728246582,24261.0,"$24.261,00",20260630
Almacen,Almacen,aceite de oliva zuccardi x 500 ml genovesa,7791728246544,24261.0,"$24.261,00",20260630
Almacen,Almacen,aceite de oliva zuelo suave x 500 ml.,7791728003574,18903.0,"$18.903,00",20260630
Almacen,Almacen,aceite de oliva zuelo x 500 m l lata intensa,7791728240887,18903.46,"$18.903,46",20260630
Almacen,Almacen,aceite de oliva zuelo x 500 ml. original,7791728022049,18903.0,"$18.903,00",20260630
Almacen,Almacen,aceite mezcla cocinero x 900 ml.,7790060234868,3459.0,"$3.459,00",20260630
Almacen,Almacen,aceite natura girasol y oliva x 900 ml.,7790272000046,7109.0,"$7.109,00",20260630
Almacen,Almacen,aceite oliva extra virgen viridian x 500 ml intenso,742832320603,20795.0,"$20.795,00",20260630
Almacen,Almacen,aceitunas goya con pasta de salmon x 149 gm,41331014892,9280.0,"$9.280,00",20260630
Almacen,Almacen,aceitunas goya x 149 gm con anchoas,41331014915,9280.0,"$9.280,00",20260630
Almacen,Almacen,aceitunas goya x 149 gm con queso azul,41331015080,9280.0,"$9.280,00",20260630
Almacen,Almacen,aceitunas goya x 149 gm rellenas con pasta de atun,41331014908,9280.0,"$9.280,00",20260630
Almacen,Almacen,aceitunas marvavic en trozos con pimiento ppizza,7793551001970,3020.0,"$3.020,00",20260630
Almacen,Almacen,aceitunas marvavic negras con carozo x 160 gm,7793551001550,3001.0,"$3.001,00",20260630
Almacen,Almacen,aceitunas marvavic negras con carozo x kg.,2024580000005,17463.0,"$17.463,00",20260630
Almacen,Almacen,aceitunas marvavic negras griegas x kg.,2024600000008,26099.0,"$26.099,00",20260630
Almacen,Almacen,aceitunas marvavic negras sin carozo x kg.,2024590000002,19857.0,"$19.857,00",20260630
Almacen,Almacen,aceitunas marvavic rellenasmorron x 90gr,7793551000669,2373.0,"$2.373,00",20260630
Almacen,Almacen,aceitunas marvavic verdes con carozo x kg.,2024650000003,13752.0,"$13.752,00",20260630
Almacen,Almacen,aceitunas marvavic verdes descarozadas x kg.,2024640000006,18324.0,"$18.324,00",20260630
Almacen,Almacen,aceitunas marvavic verdes en rodajas x kg.,2024660000000,18276.0,"$18.276,00",20260630
Almacen,Almacen,aceitunas marvavic verdes fileteadas x 200 gr.,7793551001437,1875.0,"$1.875,00",20260630
Almacen,Almacen,aceitunas marvavic verdes rellenas x kg.,2024610000005,21829.0,"$21.829,00",20260630
Almacen,Almacen,aceitunas negras en rodajas nucete x 300 gr.,7792070011156,3350.0,"$3.350,00",20260630
Almacen,Almacen,aceitunas negras en salmuera marvavic x 200 gr.,7793551000188,5319.0,"$5.319,00",20260630
Almacen,Almacen,aceitunas negras enteras marvavic x 180 gr.,7793551001895,2703.0,"$2.703,00",20260630
Almacen,Almacen,aceitunas negras marvavic x 100 gr.,7793551000645,2108.0,"$2.108,00",20260630
Almacen,Almacen,aceitunas negras scarozo nucete light x 360 gr.,7792070004615,4683.0,"$4.683,00",20260630
Almacen,Almacen,aceitunas negras vanoli x 300 gr.,7790127000306,3462.0,"$3.462,00",20260630
Almacen,Almacen,aceitunas nucete  verdes doy pack mini x 90 gm d,7792070071693,1966.0,"$1.966,00",20260630
Almacen,Almacen,aceitunas nucete negra doy pack x 300 gm con carozo.,7792070011149,2872.0,"$2.872,00",20260630
Almacen,Almacen,aceitunas nucete negras con carozo x 200 gr.,7792070000532,4102.0,"$4.102,00",20260630
Almacen,Almacen,aceitunas nucete premium verdes descarozadas x 660 gm,7792070004851,9574.0,"$9.574,00",20260630
Almacen,Almacen,aceitunas nucete verdes con carozo sachet x 800 g.,7792070001133,6594.0,"$6.594,00",20260630
Almacen,Almacen,aceitunas nucete verdes doy pack x 90 gm mini,7792070071686,1479.0,"$1.479,00",20260630
Almacen,Almacen,aceitunas nucete verdes x 300 gm rodajas coy pack,7792070001287,2956.0,"$2.956,00",20260630
Almacen,Almacen,aceitunas nucete x 90 gm doy pack mini r,7792070071716,1870.0,"$1.870,00",20260630
Almacen,Almacen,aceitunas rellenas cmorron marvavic x 150 gr. dp,7793551001888,2926.0,"$2.926,00",20260630
Almacen,Almacen,aceitunas rellenas cmorron marvavic x 200 gr.,7793551003011,4926.0,"$4.926,00",20260630
Almacen,Almacen,aceitunas rellenas marvavic cmorron x 370 gr.,7793551001529,3251.0,"$3.251,00",20260630
Almacen,Almacen,aceitunas verdes con carozo nucete frasco x 330 gr,7792070004523,3596.0,"$3.596,00",20260630
Almacen,Almacen,aceitunas verdes condimentadas marvavic x 300 gr.,7793551000270,7879.0,"$7.879,00",20260630
Almacen,Almacen,aceitunas verdes descarozadas marvavic x 140 gr.,7793551001512,2847.0,"$2.847,00",20260630
Almacen,Almacen,aceitunas verdes descarozadas marvavic x 160 gr.,7793551003028,4336.0,"$4.336,00",20260630
Almacen,Almacen,aceitunas verdes descarozadas nucete premium x 360,7792070034353,4708.0,"$4.708,00",20260630
Almacen,Almacen,aceitunas verdes en rodajas marvavic x 140 gr. doy,7793551001857,2722.0,"$2.722,00",20260630
Almacen,Almacen,aceitunas verdes en rodajas marvavic x 150 gr.,7793551001567,2845.0,"$2.845,00",20260630
Almacen,Almacen,aceitunas verdes en rodajas marvavic x 180 gr.,7793551003035,4750.0,"$4.750,00",20260630
Almacen,Almacen,aceitunas verdes en rodajas vanoli x 190 gr.,7790127733549,2289.0,"$2.289,00",20260630
Almacen,Almacen,aceitunas verdes marvavic en trozos condim. ppiza,7793551001963,1976.0,"$1.976,00",20260630
Almacen,Almacen,aceitunas verdes marvavic x 100 gr.,7793551000607,1727.0,"$1.727,00",20260630
Almacen,Almacen,aceitunas verdes marvavic x 160 gr. doy pack,7793551001840,2341.0,"$2.341,00",20260630
Almacen,Almacen,aceitunas verdes marvavic x 180 gr.,7793551001536,2467.0,"$2.467,00",20260630
Almacen,Almacen,aceitunas verdes marvavic x 330 gr.,7793551000034,4014.0,"$4.014,00",20260630
Almacen,Almacen,aceitunas verdes marvavic x 420 gr.,7793551000041,7173.0,"$7.173,00",20260630
Almacen,Almacen,aceitunas verdes marvavic x 80 gr.,7793551000683,1913.0,"$1.913,00",20260630
Almacen,Almacen,aceitunas verdes nucete premium x 220 gr.,7792070000075,4282.0,"$4.282,00",20260630
Almacen,Almacen,aceitunas verdes nucete premium x 660 gr.,7792070000068,8704.0,"$8.704,00",20260630
Almacen,Almacen,aceitunas verdes rellenas cmorron nucete x 300 gr,7792070001126,4105.0,"$4.105,00",20260630
Almacen,Almacen,aceitunas verdes rellenas nucete premium x 360 gr.,7792070034391,5331.0,"$5.331,00",20260630
Almacen,Almacen,aceitunas verdes rellenas nucete premium x 400 gr.,7792070004899,10845.0,"$10.845,00",20260630
Almacen,Almacen,aceitunas verdes rellenas nucete x 200 gr.,7792070000495,4267.0,"$4.267,00",20260630
Almacen,Almacen,aceitunas verdes vanoli x 190 gr.,7790127731040,1492.0,"$1.492,00",20260630
Almacen,Almacen,aceitunas verdes vanoli x 300 gr.,7790127000269,2676.0,"$2.676,00",20260630
Almacen,Almacen,aceto balsamico casalta glaze reducc x 250 ml. 4 p,7790139100186,5824.0,"$5.824,00",20260630
Almacen,Almacen,aceto balsamico casalta glaze x 250 ml curry,7790139004613,5824.0,"$5.824,00",20260630
Almacen,Almacen,aceto balsamico casalta manzana x 400 ml.,7790139003371,5140.0,"$5.140,00",20260630
Almacen,Almacen,aceto balsamico casalta original x 250 ml.,7790139004330,5583.0,"$5.583,00",20260630
Almacen,Almacen,aceto balsamico cocinero tipo reduccion x 250 ml.,7790070231253,2248.74,"$2.248,74",20260630
Almacen,Almacen,aceto balsamico cocinero x 250 ml. modena,7790070228031,2148.75,"$2.148,75",20260630
Almacen,Almacen,aceto balsamico dos anclas altavia gourmet x 250,7792900092966,6618.0,"$6.618,00",20260630
Almacen,Almacen,aceto balsamico dos anclas x 250 ml.,7792900000251,3249.0,"$3.249,00",20260630
Almacen,Almacen,aceto balsamico dos anclas x 500 ml,7792900990972,5442.35,"$5.442,35",20260630
Almacen,Almacen,aceto balsamico favinco x 250 ml.,7790139003425,3320.0,"$3.320,00",20260630
Almacen,Almacen,aceto balsamico glaze casalta x 250 ml. ahumado,7790139004521,5583.0,"$5.583,00",20260630
Almacen,Almacen,aceto balsamico la toscana pet x 250 ml.,7798080522057,3524.0,"$3.524,00",20260630
Almacen,Almacen,aceto balsamico la toscana x 250 ml.,7798080521272,5034.0,"$5.034,00",20260630
Almacen,Almacen,aceto balsamico lira x 250 ml.,7790070231949,2418.71,"$2.418,71",20260630
Almacen,Almacen,aceto balsamico marvavic x 250 ml.,7793551002205,7629.0,"$7.629,00",20260630
Almacen,Almacen,aceto balsamico tipo reduccion cocinero x 500 ml.,7790070231260,3958.53,"$3.958,53",20260630
Almacen,Almacen,aceto balsamico viridian x 250 ml.,742832320542,9173.0,"$9.173,00",20260630
Almacen,Almacen,aceto espeso favinco x 250 ml. ahumado,7790139004958,4469.0,"$4.469,00",20260630
Almacen,Almacen,aceto espeso favinco x 250 ml. original,7790139004941,4469.0,"$4.469,00",20260630
Almacen,Almacen,aceto espeso favinco x 500 ml. original,7790139004965,6845.0,"$6.845,00",20260630
Almacen,Almacen,aceto reduccion glaze casalta x 250 ml mostaza,7790139004606,5503.0,"$5.503,00",20260630
Almacen,Almacen,aderezo a base de mostaza aleluya x 200 gr. suave,7790158229615,3134.0,"$3.134,00",20260630
Almacen,Almacen,aderezo hellmann`s picante x 250 gr.,7794000008915,3133.0,"$3.133,00",20260630
Almacen,Almacen,aderezo hellmann`s picante x 340 gr.,7794000008922,4423.0,"$4.423,00",20260630
Almacen,Almacen,aderezo para ensalada  cocinero x 500 ml clasico,7790070265463,1748.72,"$1.748,72",20260630
Almacen,Almacen,aderezo para ensaladas tau coleslaw x 310 gr.dos anclas,7798146139052,4514.0,"$4.514,00",20260630
Almacen,Almacen,adobo para pizzas dos anclas x 25 gr.,7792900009223,1297.0,"$1.297,00",20260630
Almacen,Almacen,adobo ppizza la campagnol.x23,7790580135737,949.0,"$949,00",20260630
Almacen,Almacen,aji triturado alicante x 25 gr.,7790150406915,1075.0,"$1.075,00",20260630
Almacen,Almacen,aji triturado alicante x 50 gr.,7790150406953,1499.0,"$1.499,00",20260630
Almacen,Almacen,aji triturado la campagnola x 23 gm,7790580136062,979.0,"$979,00",20260630
Almacen,Almacen,aji triturado la campagnola x 48 gm,7790580136512,1759.0,"$1.759,00",20260630
Almacen,Almacen,ajies en vinagre marvavic x 120 gr.,7793551000294,5459.0,"$5.459,00",20260630
Almacen,Almacen,ajies en vinagre nucete x 330 gr.,7792070000754,5168.0,"$5.168,00",20260630
Almacen,Almacen,ajies marvavic en vinagre de alcohol x 220 gr.,7793551000300,9001.0,"$9.001,00",20260630
Almacen,Almacen,ajies marvavic enteros 900gr x kg.,2024670000007,34755.0,"$34.755,00",20260630
Almacen,Almacen,ajo badia asado x 170.1 gr,33844003906,15047.0,"$15.047,00",20260630
Almacen,Almacen,ajo triturado alicante x50gr.n,7790150411391,1758.0,"$1.758,00",20260630
Almacen,Almacen,ajo triturado la campagnola x 48 gr,7790580136123,1429.0,"$1.429,00",20260630
Almacen,Almacen,albahaca alicante x 20 gr.,7790150413005,1075.0,"$1.075,00",20260630
Almacen,Almacen,alcaparras gentleman x110gr.,7790645002462,3102.0,"$3.102,00",20260630
Almacen,Almacen,alcaparras marvavic frasco x 100 gm,7793551002830,4679.0,"$4.679,00",20260630
Almacen,Almacen,alf. cofler block x60gr,7790040659605,1339.0,"$1.339,00",20260630
Almacen,Almacen,alf.bon o bon x40gr.negro,7790040613706,889.0,"$889,00",20260630
Almacen,Almacen,alf.bon o bon x6u.negro,7790040613904,6210.0,"$6.210,00",20260630
Almacen,Almacen,alf.cofler block x6unid.,7790040143630,4689.0,"$4.689,00",20260630
Almacen,Almacen,alf.cofler x40gr.mousse,7790040143647,1146.0,"$1.146,00",20260630
Almacen,Almacen,alfajor blanco y negro x 73 gm negro,7790040375000,1459.0,"$1.459,00",20260630
Almacen,Almacen,alfajor blano,7790040991910,1459.0,"$1.459,00",20260630
Almacen,Almacen,alfajor bon o bon x 60 gm triple,7790040148840,2084.0,"$2.084,00",20260630
Almacen,Almacen,alfajor cachafaz blanco x 6 unid.,7798128000493,13836.0,"$13.836,00",20260630
Almacen,Almacen,alfajor cachafaz mousse de chocolate x 6 unid.,7798128000257,13836.0,"$13.836,00",20260630
Almacen,Almacen,alfajor chocoarroz 6 x 36 gm dulce de leche,7790070103314,6139.0,"$6.139,00",20260630
Almacen,Almacen,alfajor chocoarroz blanco x 6 unid.,7790070418302,4749.0,"$4.749,00",20260630
Almacen,Almacen,alfajor chocoarroz dulce de leche x 6 unid.,7790070418227,4739.0,"$4.739,00",20260630
Almacen,Almacen,alfajor chocoarroz limon x 6 unid.,7790070418265,4739.0,"$4.739,00",20260630
Almacen,Almacen,alfajor chocoarroz marroc x 6 unid.,7790070418340,4739.0,"$4.739,00",20260630
Almacen,Almacen,alfajor chocotorta x 71 gm,7790040150072,1459.0,"$1.459,00",20260630
Almacen,Almacen,alfajor cofler block x 40 gr.,7790040143654,1251.0,"$1.251,00",20260630
Almacen,Almacen,alfajor cofler x 60 gr choco creamy,7790040150010,1876.0,"$1.876,00",20260630
Almacen,Almacen,alfajor milka blanco x 70 gm super dulce de leche,7622202370045,2240.6,"$2.240,60",20260630
Almacen,Almacen,alfajor milka mousse x 42 gr.,7622300759506,1761.0,"$1.761,00",20260630
Almacen,Almacen,alfajor milka mousse x 6 unid. chocolate,7622300759490,9427.0,"$9.427,00",20260630
Almacen,Almacen,alfajor milka x55gr.trimous.bl,7622300457303,2241.0,"$2.241,00",20260630
Almacen,Almacen,alfajor mini milka x 114 gm,7622202220074,3940.0,"$3.940,00",20260630
Almacen,Almacen,alfajor minitorta aguila coco,7790040133600,1389.0,"$1.389,00",20260630
Almacen,Almacen,alfajor pepito triple x 57 gr.,77915481,2241.0,"$2.241,00",20260630
Almacen,Almacen,alfajor santafesino deubel triple x 12 unid.,7791696001121,12926.0,"$12.926,00",20260630
Almacen,Almacen,alfajor shot simple x 44 gm pasta de mani,7622202304705,1597.0,"$1.597,00",20260630
Almacen,Almacen,alfajor shot x 36 gm triple blanco,7622202816437,2120.0,"$2.120,00",20260630
Almacen,Almacen,alfajor shot x60gr.triple,77956699,2120.0,"$2.120,00",20260630
Almacen,Almacen,alfajor terrabusi chocolate,77939234,1490.0,"$1.490,00",20260630
Almacen,Almacen,alfajor terrabusi clasico x 70 gr.,77903792,2241.0,"$2.241,00",20260630
Almacen,Almacen,alfajor terrabusi glaseado x 38 gr.,7622300202859,1364.0,"$1.364,00",20260630
Almacen,Almacen,alfajor terrabusi sin gluten x 55 gm,7622202296291,2045.0,"$2.045,00",20260630
Almacen,Almacen,alfajor terrabusi triple blanco x 70 gm,7622202805554,2241.0,"$2.241,00",20260630
Almacen,Almacen,alfajor terrabusi x6 chocolate,7622300742584,4599.0,"$4.599,00",20260630
Almacen,Almacen,alfajor terrabusi x6 glaseado,7622300742621,4599.0,"$4.599,00",20260630
Almacen,Almacen,alfajor terrabusi x70gr.torta,77903860,2120.0,"$2.120,00",20260630
Almacen,Almacen,alfajor tita x36gr.,77908308,1088.0,"$1.088,00",20260630
Almacen,Almacen,almendras peladas zyma x 150 gr.,7798130190021,8415.0,"$8.415,00",20260630
Almacen,Almacen,almendras peladas zyma x 300 gr.,7798130191400,13012.0,"$13.012,00",20260630
Almacen,Almacen,almendras sin cascara x kg.,2011770000006,34230.0,"$34.230,00",20260630
Almacen,Almacen,almidon de maiz maizena x 220 gr.,7794000007451,2159.0,"$2.159,00",20260630
Almacen,Almacen,almidon de maiz maizena x 500 gr.,7794000007468,3689.0,"$3.689,00",20260630
Almacen,Almacen,almidon de maiz yuspe x 500 gr.,7794980363837,2316.0,"$2.316,00",20260630
Almacen,Almacen,anana morixe x 836 gm rodajas finas,7790199605607,6776.0,"$6.776,00",20260630
Almacen,Almacen,ananas en trozos comunes gentleman x 825 gr.,7790645003322,6338.0,"$6.338,00",20260630
Almacen,Almacen,anchoas en aceite x kg.,2025820000007,129275.0,"$129.275,00",20260630
Almacen,Almacen,ani.cereal pura vida x200g.fru,7798309870297,1920.0,"$1.920,00",20260630
Almacen,Almacen,anis granos alicante x25gr.,7790150420331,1213.0,"$1.213,00",20260630
Almacen,Almacen,antipasto vegetal en aceite marvavic x 250 gr.,7793551000539,7568.0,"$7.568,00",20260630
Almacen,Almacen,aromatizante artificial yuspe limon x 110 cc,7794980368504,1606.0,"$1.606,00",20260630
Almacen,Almacen,aromatizante artificial yuspe naranja x 110 cc,7794980368535,1606.0,"$1.606,00",20260630
Almacen,Almacen,arroz doble carolina trimacer x 1 kg.,7794836000015,2517.0,"$2.517,00",20260630
Almacen,Almacen,arroz doble carolina trimacer x 500 gr.,7794836000022,1259.0,"$1.259,00",20260630
Almacen,Almacen,arroz don elio doble carolina x 500 gr.,7798048720266,1510.0,"$1.510,00",20260630
Almacen,Almacen,arroz gallo carnaroli x 500 gr.,7790070411792,2950.0,"$2.950,00",20260630
Almacen,Almacen,arroz gallo oro x1kg.parb.est.,7790070433091,2863.75,"$2.863,75",20260630
Almacen,Almacen,arroz gallo risotto 4 quesos x 240 gr.,7790070431721,3390.01,"$3.390,01",20260630
Almacen,Almacen,arroz l.egip.x500gr.fort.doble,7790681001139,1379.0,"$1.379,00",20260630
Almacen,Almacen,arroz largo fino 00000 la egipciana x 500 gr.,7790681002150,999.0,"$999,00",20260630
Almacen,Almacen,arroz largo fino maria x 1 kg.,7790387070019,1936.0,"$1.936,00",20260630
Almacen,Almacen,arroz largo fino maria x 500 gr.,7790387070026,1015.0,"$1.015,00",20260630
Almacen,Almacen,arroz largo fino mocovi estuche x 1 kg.,7794580000248,1950.0,"$1.950,00",20260630
Almacen,Almacen,arroz largo fino tio quico x 1 kg.,7794836000107,1573.0,"$1.573,00",20260630
Almacen,Almacen,arroz largo fino trimacer 00000 x 1 kg.,7794836000046,1739.0,"$1.739,00",20260630
Almacen,Almacen,arroz largo fino trimacer 00000 x 500 gr.,7794836000053,1022.0,"$1.022,00",20260630
Almacen,Almacen,arroz lucchetti doble carolina x 1 kg.,7790070431462,3269.0,"$3.269,00",20260630
Almacen,Almacen,arroz lucchetti parb.sel.x500g,7790070431516,1049.0,"$1.049,00",20260630
Almacen,Almacen,arroz lucchetti x500gr.l.fino,7790070431493,979.0,"$979,00",20260630
Almacen,Almacen,arroz maximo largo fino x 1 kg.,7790070412126,1905.0,"$1.905,00",20260630
Almacen,Almacen,arroz maximo largo fino x 500 gr.,7790070412171,997.0,"$997,00",20260630
Almacen,Almacen,arroz mocovi doble carolina x 1 kg.,7794580003065,2315.0,"$2.315,00",20260630
Almacen,Almacen,arroz mocovi doble carolina x 500 gr.,7794580003072,1216.0,"$1.216,00",20260630
Almacen,Almacen,arroz mocovi largo fino x 500 gr.,7794580003041,778.0,"$778,00",20260630
Almacen,Almacen,arroz mocovi x 1 kilo doble carolina en caja,7794580000019,2662.0,"$2.662,00",20260630
Almacen,Almacen,arroz mocovi x 1 kilo largo fino,7794580003058,1483.0,"$1.483,00",20260630
Almacen,Almacen,arroz mocovi x 500 gr largo fino estuche,7794580000040,1024.0,"$1.024,00",20260630
Almacen,Almacen,arroz mocovi x 500 gr. doble carolina,7794580000026,1398.0,"$1.398,00",20260630
Almacen,Almacen,arroz prep.gallo x240gr.queso,7790070432261,2233.22,"$2.233,22",20260630
Almacen,Almacen,arroz prep.gallo x240gr.verdeo,7790070432278,2233.22,"$2.233,22",20260630
Almacen,Almacen,arroz primor largo fino x 1 kg.,7794870001344,1313.0,"$1.313,00",20260630
Almacen,Almacen,arroz vincha de oro largo fino x 1 kg.,7794580000255,1309.0,"$1.309,00",20260630
Almacen,Almacen,arroz yamani gallo estuche x 500 gr.,7790070411914,2822.0,"$2.822,00",20260630
Almacen,Almacen,arvejas la egipciana,7790681001177,1219.0,"$1.219,00",20260630
Almacen,Almacen,arvejas partidas la egipciana x 400 gr.,7790681000316,1392.0,"$1.392,00",20260630
Almacen,Almacen,arvejas partidas las achiras x 400 gr.,7790681000200,969.0,"$969,00",20260630
Almacen,Almacen,arvejas sec.rem.l.campagn.x300,7793360132384,1261.0,"$1.261,00",20260630
Almacen,Almacen,arvejas secas enteras la egipciana x 500 gr.,7790681000309,1392.0,"$1.392,00",20260630
Almacen,Almacen,arvejas secas remojadas don elio x 350 gr.,7798048721171,767.0,"$767,00",20260630
Almacen,Almacen,atun al natural en lomo la campagnola x 170 gr.,7790580131364,5432.0,"$5.432,00",20260630
Almacen,Almacen,atun caracas x170gr.desm.aceit,7790645001809,1794.0,"$1.794,00",20260630
Almacen,Almacen,atun caracas x170gr.desm.natur,7790645002363,1794.0,"$1.794,00",20260630
Almacen,Almacen,atun desmenuzado al natural la campagnola x 170 g.,7793360129957,2879.0,"$2.879,00",20260630
Almacen,Almacen,atun desmenuzado natural morixe x 170 gm,7790199604785,1646.0,"$1.646,00",20260630
Almacen,Almacen,atun desmunuzado morixe en aceite x 170 gm,7790199604792,1646.0,"$1.646,00",20260630
Almacen,Almacen,atun en aceite en lomo la campagnola x 170 gr.,7790580131357,5432.0,"$5.432,00",20260630
Almacen,Almacen,atun entero en aceite puglisi x 170 gr. sin sal,7790748266457,4132.0,"$4.132,00",20260630
Almacen,Almacen,atun la campagnola x 170 gm ahumado,7790580143718,5582.0,"$5.582,00",20260630
Almacen,Almacen,avellanas con chocolate con leche nestle x 80 gm,8445291996731,3240.0,"$3.240,00",20260630
Almacen,Almacen,avena arrollada tradicional don elio x 400 gr.,7798048720228,1803.0,"$1.803,00",20260630
Almacen,Almacen,avena instantanea don elio400g,7798048721553,1877.0,"$1.877,00",20260630
Almacen,Almacen,avena instantanea granix x 400 gr.,7790045823575,3560.0,"$3.560,00",20260630
Almacen,Almacen,avena l.egip.arr.trad.x300gr.,7790681002174,1849.0,"$1.849,00",20260630
Almacen,Almacen,avena l.egip.x300gr.,7790681000927,1979.0,"$1.979,00",20260630
Almacen,Almacen,avena quaker x 500 gr. instantanea,7792170555536,3261.0,"$3.261,00",20260630
Almacen,Almacen,avena quaker x470gr.ext.fina,7792170555512,3261.0,"$3.261,00",20260630
