categoria,cat_principal,nombre,ean,precio,precio_texto,fecha
Almacen,Almacen,tableta milka x 20 gm oreo,7622210795908,1690.0,"$1.690,00",20260630
Almacen,Almacen,tableta milka x 25 gm chocolate con leche,7622202322143,2508.0,"$2.508,00",20260630
Almacen,Almacen,tableta milka x 29 gm rellena de dulce  de leche,7622202322068,2640.0,"$2.640,00",20260630
Almacen,Almacen,tableta oreo,7622210277503,31487.0,"$31.487,00",20260630
Almacen,Almacen,tallarin don vicente x 500 gr.,7790070336576,3675.0,"$3.675,00",20260630
Almacen,Almacen,tallarin matarazzo x 500 gr.,7790070336316,1977.0,"$1.977,00",20260630
Almacen,Almacen,tallarin terrabusi x 500 gr.,7790070336477,1296.0,"$1.296,00",20260630
Almacen,Almacen,thins almadre sesamo y sal marina x 160 gr.,7798371600068,3581.0,"$3.581,00",20260630
Almacen,Almacen,thins almadre x 160 gm integral,7798371600051,3581.0,"$3.581,00",20260630
Almacen,Almacen,toblerone x100gr.leche,7614500010013,13078.0,"$13.078,00",20260630
Almacen,Almacen,tomate pelado cubet.l.camp.400,7793360105944,1736.0,"$1.736,00",20260630
Almacen,Almacen,tomate perita arcor x400gr.ent,7790580567903,1311.0,"$1.311,00",20260630
Almacen,Almacen,tomate triturado dulcor x 960 gr.,7793046015024,1670.94,"$1.670,94",20260630
Almacen,Almacen,tomates cubeteados alco x 400 gr.,7798132920794,1181.0,"$1.181,00",20260630
Almacen,Almacen,tomates cubeteados arcor x 400 gr.,7790580567101,1508.0,"$1.508,00",20260630
Almacen,Almacen,tomates en cubitos salsati x 400 gr.,7790580147266,1894.0,"$1.894,00",20260630
Almacen,Almacen,tomates perita salsati x 400 gr.,7790580147242,1647.0,"$1.647,00",20260630
Almacen,Almacen,tomillo alicante x 10 gr.,7790150600344,956.0,"$956,00",20260630
Almacen,Almacen,tomillo la campagnola x15gr.,7793360124945,729.0,"$729,00",20260630
Almacen,Almacen,tostadas libre de gluten salmas x 90 gr clasicas,7793890261844,2922.0,"$2.922,00",20260630
Almacen,Almacen,tostadas molinos ala veggie x 150 gr.,7791120102868,2485.0,"$2.485,00",20260630
Almacen,Almacen,tostadas schar x 87 gm,8008698028582,10525.0,"$10.525,00",20260630
Almacen,Almacen,tostaditas molinos ala x 100 gm veggie,7791120104879,1580.0,"$1.580,00",20260630
Almacen,Almacen,tostaditas molinos ala x 100 gr clasicas,7791120102769,1422.0,"$1.422,00",20260630
Almacen,Almacen,trigo burgol la egipciana triturado,7790681000231,2432.0,"$2.432,00",20260630
Almacen,Almacen,trigo don elio x400gr. candeal pelado,7798048720235,2056.0,"$2.056,00",20260630
Almacen,Almacen,trigo l.egip.x400gr.pelado,7790681000293,1822.0,"$1.822,00",20260630
Almacen,Almacen,turron oblea arcor 10x25gr.,7790580401504,3139.0,"$3.139,00",20260630
Almacen,Almacen,turron oblea arcor x25gr.,77940131,329.0,"$329,00",20260630
Almacen,Almacen,vainilla liquida yuspe x 110 cc,7794980912233,1531.0,"$1.531,00",20260630
Almacen,Almacen,veggie snacks granix x 90 gr. barbacoa,7790045825845,2149.0,"$2.149,00",20260630
Almacen,Almacen,vinagre de alcohol casalta x 500 ml.,7790139003166,1380.0,"$1.380,00",20260630
Almacen,Almacen,vinagre de alcohol favinco x 500 ml.,7790139101145,1331.0,"$1.331,00",20260630
Almacen,Almacen,vinagre de alcohol marvavic x 1 lt.,7793551001055,2100.0,"$2.100,00",20260630
Almacen,Almacen,vinagre de alcohol marvavic x 500 ml.,7793551001024,1440.0,"$1.440,00",20260630
Almacen,Almacen,vinagre de manzana casalta x 1 lt.,7790139003265,4429.0,"$4.429,00",20260630
Almacen,Almacen,vinagre de manzana dos anclas x 1 lt.,7792900093260,4103.0,"$4.103,00",20260630
Almacen,Almacen,vinagre de manzana marvavic x 1 lt.,7793551001079,3000.0,"$3.000,00",20260630
Almacen,Almacen,vinagre de vino casalta x 500 ml.,7790139003296,2197.0,"$2.197,00",20260630
Almacen,Almacen,vinagre de vino dos anclas x 1 lt.,7792900093253,3042.0,"$3.042,00",20260630
Almacen,Almacen,vinagre de vino favinco x 500 ml.,7790139101169,2083.0,"$2.083,00",20260630
Almacen,Almacen,vinagre de vino marvavic x 1 lt.,7793551001062,2624.0,"$2.624,00",20260630
Almacen,Almacen,vinagre de vino marvavic x 500 ml.,7793551001031,1736.0,"$1.736,00",20260630
Almacen,Almacen,vinagre favinco sabor finas hierbas x 1 lt.,7790139101565,2655.0,"$2.655,00",20260630
Almacen,Almacen,vinagre favinco x1lt.manzana,7790139101176,4324.0,"$4.324,00",20260630
Almacen,Almacen,zanahoria deshidratada knorr x 100 gr.,7794000006126,2619.0,"$2.619,00",20260630
Almacen,Almacen,zanahoria doaa pupa x 340 gm,7798096031222,1079.75,"$1.079,75",20260630
Bebidas,Bebidas,ades x1lt.anana,7790895643804,2529.0,"$2.529,00",20260630
Bebidas,Bebidas,"agua benedictino sin gas x 2,25 lt.",7790895647666,2590.0,"$2.590,00",20260630
Bebidas,Bebidas,agua benedictino sin gas x 500 ml.,7790895647642,1520.0,"$1.520,00",20260630
Bebidas,Bebidas,agua benedictino x 1.5 litros sin gas,7790895647659,2190.0,"$2.190,00",20260630
Bebidas,Bebidas,"agua bonaqua x 1,5 lt. con gas",7790895003950,2390.0,"$2.390,00",20260630
Bebidas,Bebidas,agua bonaqua x 2.5 lt. sin gas,7790895008146,3040.0,"$3.040,00",20260630
Bebidas,Bebidas,agua fullsport x 500 ml f blue,7799155001750,1449.0,"$1.449,00",20260630
Bebidas,Bebidas,agua fullsport x 500 ml frutas tropicales,7799155001767,1449.0,"$1.449,00",20260630
Bebidas,Bebidas,agua fullsport x 500 ml sabor manzana,7799155001743,1449.0,"$1.449,00",20260630
Bebidas,Bebidas,agua mineral asuncion x 5 lt.,7798340590086,4197.0,"$4.197,00",20260630
Bebidas,Bebidas,agua mineral asuncion x 600 ml.,7798340590062,1061.0,"$1.061,00",20260630
Bebidas,Bebidas,"agua mineral asuncion x1,5lt.",7798340590079,1254.0,"$1.254,00",20260630
Bebidas,Bebidas,agua mineral bonaqua sin gas x 2 lt.,7790895003882,2850.0,"$2.850,00",20260630
Bebidas,Bebidas,"agua mineral bonaqua x 1,5 ml. sin gas",7790895003875,2390.0,"$2.390,00",20260630
Bebidas,Bebidas,agua mineral bonaqua x 500 ml. sin gas,7790895003868,1690.0,"$1.690,00",20260630
Bebidas,Bebidas,"agua mineral con gas villavicencio x 1,5 lt.",7799155000210,3125.0,"$3.125,00",20260630
Bebidas,Bebidas,agua mineral eco de los andes sin gas x 850 ml.,7795930002097,1619.0,"$1.619,00",20260630
Bebidas,Bebidas,agua mineral eco de los andes x 2 lt. sin gas,7792799000097,2079.0,"$2.079,00",20260630
Bebidas,Bebidas,agua mineral glaciar sin gas x 1.5 litros,7792931000022,2019.0,"$2.019,00",20260630
Bebidas,Bebidas,"agua mineral glaciar x 6,3 lt.",7795930000550,6059.0,"$6.059,00",20260630
Bebidas,Bebidas,agua mineral magna x 1 litro,7791913005741,1133.0,"$1.133,00",20260630
Bebidas,Bebidas,agua mineral magna x 1.5 litros,7791913005710,1169.0,"$1.169,00",20260630
Bebidas,Bebidas,agua mineral magna x 2 litros,7791913005727,1349.0,"$1.349,00",20260630
Bebidas,Bebidas,agua mineral pureza vital x2.25lt.sin gas,7795930000543,1779.0,"$1.779,00",20260630
Bebidas,Bebidas,agua mineral ser baja en sodio x 1.5 litros,7799155001668,2229.0,"$2.229,00",20260630
Bebidas,Bebidas,agua mineral ser x 2.5 litros baja en sodio,7799155001675,2509.0,"$2.509,00",20260630
Bebidas,Bebidas,agua mineral sin gas eco de los andes x 1.5 lt.,7792799000059,1829.0,"$1.829,00",20260630
Bebidas,Bebidas,agua mineral sin gas glaciar x 750 ml.,7795930000567,1609.0,"$1.609,00",20260630
Bebidas,Bebidas,"agua mineral sin gas villa del sur x 2,25 lt.",7798062547559,1969.0,"$1.969,00",20260630
Bebidas,Bebidas,agua mineral sin gas villa del sur x 600 ml.,7798062540109,1459.0,"$1.459,00",20260630
Bebidas,Bebidas,agua mineral sin gas villavicencio x 500 ml.,7799155000173,2032.0,"$2.032,00",20260630
Bebidas,Bebidas,"agua mineral villa del sur x 1,65 lt. sin gas",7790315000149,1719.0,"$1.719,00",20260630
Bebidas,Bebidas,"agua mineral villa del sur x 6,2 lt.",7799155000135,5712.0,"$5.712,00",20260630
Bebidas,Bebidas,agua mineral villavicencio con gas x 500 ml.,7799155000203,2032.0,"$2.032,00",20260630
Bebidas,Bebidas,agua mineral villavicencio sin gas x 1.5 lt.,7799155000180,1939.0,"$1.939,00",20260630
Bebidas,Bebidas,agua mineral villavicencio sport x 750 ml. sin gas,7790315058201,1879.0,"$1.879,00",20260630
Bebidas,Bebidas,agua mineral villavicencio x 2 litros sin gas,7799155000197,2169.0,"$2.169,00",20260630
Bebidas,Bebidas,agua saborizada aquarius cepita limonada x 500 ml.,7790895008481,1763.0,"$1.763,00",20260630
Bebidas,Bebidas,agua saborizada aquarius cepita manzana x 1.5 lts.,7790895640483,3150.0,"$3.150,00",20260630
Bebidas,Bebidas,agua saborizada aquarius cepita manzana x 2.25 lt.,7790895003301,3109.0,"$3.109,00",20260630
Bebidas,Bebidas,agua saborizada aquarius cepita manzana x 500 ml.,7790895640452,1763.0,"$1.763,00",20260630
Bebidas,Bebidas,agua saborizada aquarius cepita naranja x 1.5 lt.,7790895641237,3150.0,"$3.150,00",20260630
Bebidas,Bebidas,agua saborizada aquarius cepita naranja x 2.25 lt.,7790895003325,3109.0,"$3.109,00",20260630
Bebidas,Bebidas,agua saborizada aquarius cepita pera x 2.25 lt.,7790895003295,3109.0,"$3.109,00",20260630
Bebidas,Bebidas,agua saborizada aquarius cepita pomelo x 1.5 lts.,7790895640490,3150.0,"$3.150,00",20260630
Bebidas,Bebidas,agua saborizada aquarius cepita uva x 1.5 lt.,7790895641220,3150.0,"$3.150,00",20260630
Bebidas,Bebidas,agua saborizada aquarius cepita uva x 2.25 lt.,7790895003318,3109.0,"$3.109,00",20260630
Bebidas,Bebidas,agua saborizada aquarius cepita uva x 500 ml.,7790895641206,1763.0,"$1.763,00",20260630
Bebidas,Bebidas,"agua saborizada aquarius x 1,5 lt. limonada",7790895008498,3150.0,"$3.150,00",20260630
Bebidas,Bebidas,agua saborizada brio multifruta x 1.5 lt.,7798062545487,1940.0,"$1.940,00",20260630
Bebidas,Bebidas,"agua saborizada brio x 1,5 lt. manzana",7798062543919,1940.0,"$1.940,00",20260630
Bebidas,Bebidas,"agua saborizada brio x 1,5 lt. naranja",7798062543926,1940.0,"$1.940,00",20260630
Bebidas,Bebidas,"agua saborizada brio x 1,5 lt. pomelo",7798062543933,1940.0,"$1.940,00",20260630
Bebidas,Bebidas,agua saborizada cellier manzana x 1.5 lt.,7798113302670,1532.0,"$1.532,00",20260630
Bebidas,Bebidas,agua saborizada cellier naranja x 1.5 lt.,7798113302700,1532.0,"$1.532,00",20260630
Bebidas,Bebidas,agua saborizada h2o x 500 ml sin gas naranja,7791813402886,909.0,"$909,00",20260630
Bebidas,Bebidas,agua saborizada h2o! limoneto x 15 lt. suavemente gasificad,7791813421917,2750.0,"$2.750,00",20260630
Bebidas,Bebidas,agua saborizada h2oh  sin gas x 2 litros limoneto,7791813405023,1679.0,"$1.679,00",20260630
Bebidas,Bebidas,agua saborizada h2oh sin gas x 500 ml manzana,7791813402039,909.0,"$909,00",20260630
Bebidas,Bebidas,agua saborizada h2oh suavemente gasificada x 2.25 litros cit,7791813423591,3200.0,"$3.200,00",20260630
Bebidas,Bebidas,agua saborizada h2oh x 1.5 litros limoneto sin gas,7791813403029,1519.0,"$1.519,00",20260630
Bebidas,Bebidas,agua saborizada levite  x 2.25 litros pomelo rosado,7799155001408,3039.0,"$3.039,00",20260630
Bebidas,Bebidas,"agua saborizada levite cero x 1,5 lt. pomelo",7790315000910,3307.0,"$3.307,00",20260630
Bebidas,Bebidas,agua saborizada levite x 1.5 litros sabor pomelo amarilo,7798062548679,3307.0,"$3.307,00",20260630
Bebidas,Bebidas,agua saborizada levite x 1.5 lt pomelo rosado,7799155001392,3307.0,"$3.307,00",20260630
Bebidas,Bebidas,agua saborizada levite x 2.25 litros naranja,7798062540291,3039.0,"$3.039,00",20260630
Bebidas,Bebidas,agua saborizada levite x 2.25 lt limonada,7799155001705,3039.0,"$3.039,00",20260630
Bebidas,Bebidas,agua saborizada levite x 500 ml limonada,7799155001682,1799.0,"$1.799,00",20260630
Bebidas,Bebidas,agua saborizada sin gas h2oh x 1.5 litros pomelada,7791813403012,1519.0,"$1.519,00",20260630
Bebidas,Bebidas,agua saborizada sin gas h2oh x 1.5 litros sabor manzana,7791813403036,1519.0,"$1.519,00",20260630
Bebidas,Bebidas,agua saborizada sin gas h2oh x 2 litros sabor manzana,7791813405030,1679.0,"$1.679,00",20260630
Bebidas,Bebidas,agua saborizada sin gas h2oh x 500 ml pomelada,7791813402015,909.0,"$909,00",20260630
Bebidas,Bebidas,agua saborizada suavemente gasificada h2oh x 1.5 lit.citrus,7791813421603,2750.0,"$2.750,00",20260630
Bebidas,Bebidas,agua saborizada suavemente gasificada h2oh x 2.25 l.limoneto,7791813423911,3200.0,"$3.200,00",20260630
Bebidas,Bebidas,agua saborizada vds levite cero manzana x 1.5 lt.,7790315001061,3307.0,"$3.307,00",20260630
Bebidas,Bebidas,agua saborizada vds levite cero manzana x 2.25 lt.,7790315001085,3039.0,"$3.039,00",20260630
Bebidas,Bebidas,agua saborizada vds levite cero manzana x 2.25 lt.,7790315001054,3039.0,"$3.039,00",20260630
Bebidas,Bebidas,agua saborizada vds levite cero pomelo x 2.25 lt.,7790315001047,3039.0,"$3.039,00",20260630
Bebidas,Bebidas,agua saborizada vds levite cero pomelo x 500 ml.,7790315100177,1799.0,"$1.799,00",20260630
Bebidas,Bebidas,agua saborizada vds levite manzana x 1.5 lt.,7798062548709,3307.0,"$3.307,00",20260630
Bebidas,Bebidas,agua saborizada vds levite manzana x 2.25 lt.,7790315000880,3039.0,"$3.039,00",20260630
Bebidas,Bebidas,"agua saborizada vds levite naranja x 1,5 lt.",7798062548648,3307.0,"$3.307,00",20260630
Bebidas,Bebidas,agua saborizada vds levite pera x 1.5 lt.,7798062540253,3307.0,"$3.307,00",20260630
Bebidas,Bebidas,"agua saborizada villa del sur levite x 2,25 lt. pe",7798062541014,3039.0,"$3.039,00",20260630
Bebidas,Bebidas,agua tonica paso de los toros x 1.5 lt.,7791813421368,2559.0,"$2.559,00",20260630
Bebidas,Bebidas,agua tonica schweppes x 1.5 lt.,7790895006715,3790.0,"$3.790,00",20260630
Bebidas,Bebidas,agua tonica schweppes x 310 ml zero,7790895648571,1520.0,"$1.520,00",20260630
Bebidas,Bebidas,agua tonica schweppes x 310 ml.,7790895003202,1520.0,"$1.520,00",20260630
Bebidas,Bebidas,alimento de soja ades anana x 200 ml.,7790895643712,1038.0,"$1.038,00",20260630
Bebidas,Bebidas,alimento de soja ades durazno x 1 lt.,7790895643828,2529.0,"$2.529,00",20260630
Bebidas,Bebidas,alimento de soja ades durazno x 200 ml.,7790895643729,1038.0,"$1.038,00",20260630
Bebidas,Bebidas,alimento de soja ades frutas tropicales x 1 lt.,7790895643866,2529.0,"$2.529,00",20260630
Bebidas,Bebidas,alimento de soja ades frutas tropicales x 200 ml.,7790895643767,1038.0,"$1.038,00",20260630
Bebidas,Bebidas,alimento de soja ades manzana x 1 lt.,7790895643835,2529.0,"$2.529,00",20260630
Bebidas,Bebidas,alimento de soja ades manzana x 200 ml.,7790895643743,1038.0,"$1.038,00",20260630
Bebidas,Bebidas,alimento de soja ades naranja x 1 lt.,7790895643842,2529.0,"$2.529,00",20260630
Bebidas,Bebidas,amargo obrero x 950 ml.,7790950001969,5599.0,"$5.599,00",20260630
Bebidas,Bebidas,amargo tacconi con limon dietetico x 1.5 lt.,7790950003055,1599.0,"$1.599,00",20260630
Bebidas,Bebidas,amargo tacconi serrano x 1.5 lt.,7790950003048,1599.0,"$1.599,00",20260630
Bebidas,Bebidas,amargo tacconi x 1.5 lt blanco,7790950003062,1599.0,"$1.599,00",20260630
Bebidas,Bebidas,"amargo terma cero x 1,35 lt. cuyano",7790950133349,2751.0,"$2.751,00",20260630
Bebidas,Bebidas,"amargo terma cero x 1,35 lt. manzana",7790950133370,2953.0,"$2.953,00",20260630
Bebidas,Bebidas,"amargo terma cero x 1,35 lt. serrano",7790950133325,2953.0,"$2.953,00",20260630
Bebidas,Bebidas,"amargo terma citrus x 1,35 lt.",7790950135992,2953.0,"$2.953,00",20260630
Bebidas,Bebidas,"amargo terma sin azucar x 1,35 lt. pomelo",7790950143690,2953.0,"$2.953,00",20260630
Bebidas,Bebidas,"amargo terma x 1,35 lt. cuyano",7790950133332,2751.0,"$2.751,00",20260630
Bebidas,Bebidas,"amargo terma x 1,35 lt. limon",7790950133271,2751.0,"$2.751,00",20260630
Bebidas,Bebidas,"amargo terma x 1,35 lt. pomelo",7790950133257,2751.0,"$2.751,00",20260630
Bebidas,Bebidas,"amargo terma x 1,35 lt. pomelo rosado",7790950133363,2953.0,"$2.953,00",20260630
Bebidas,Bebidas,"amargo terma x 1,35 lt. serrano",7790950133318,2953.0,"$2.953,00",20260630
Bebidas,Bebidas,"amargo terma x 1,75 ml. citrus",7790950139273,2970.0,"$2.970,00",20260630
Bebidas,Bebidas,"amargo tres torres x 1,5 lt. blanco",7790950003437,1299.0,"$1.299,00",20260630
Bebidas,Bebidas,"amargo tres torres x 1,5 lt. limon",7790950003444,1299.0,"$1.299,00",20260630
Bebidas,Bebidas,"amargo tres torres x 1,5 lt. serrano",7790950003420,1299.0,"$1.299,00",20260630
Bebidas,Bebidas,americano gancia hibiscus x 473 ml.,7790950144826,2699.0,"$2.699,00",20260630
Bebidas,Bebidas,americano gancia hibiscus x 750 ml.,7790950144819,11619.0,"$11.619,00",20260630
Bebidas,Bebidas,americano gancia lima limon x 473 ml.,7790950142921,2499.0,"$2.499,00",20260630
Bebidas,Bebidas,americano gancia x 450 ml.,7790950000191,5299.0,"$5.299,00",20260630
Bebidas,Bebidas,americano gancia x 473 ml sin alcohol lata,7790950147926,1199.0,"$1.199,00",20260630
Bebidas,Bebidas,americano gancia x950ml.,7790950000160,9174.0,"$9.174,00",20260630
Bebidas,Bebidas,americano marcela x950ml.,7790950002768,5483.0,"$5.483,00",20260630
Bebidas,Bebidas,anana fizz la victoria x 720 ml.,7792316000036,4007.0,"$4.007,00",20260630
Bebidas,Bebidas,aper.cazalis leger x950ml.,7791200200767,5734.0,"$5.734,00",20260630
Bebidas,Bebidas,aperitivo aperol x 750 ml.,7891136057029,11899.0,"$11.899,00",20260630
Bebidas,Bebidas,aperitivo campari x 450 ml.,7791200000565,8208.0,"$8.208,00",20260630
Bebidas,Bebidas,aperitivo campari x 750 ml.,7891136052000,12099.0,"$12.099,00",20260630
Bebidas,Bebidas,aperitivo cinzano bianco x 450 ml.,7791200000572,4467.0,"$4.467,00",20260630
Bebidas,Bebidas,aperitivo cinzano bianco x 950 ml.,7791200200538,8489.0,"$8.489,00",20260630
Bebidas,Bebidas,aperitivo cinzano rosso x 1 lt.,7791200200552,9969.0,"$9.969,00",20260630
Bebidas,Bebidas,aperitivo cinzano segundo x 750 ml.,7791200200712,12465.0,"$12.465,00",20260630
Bebidas,Bebidas,aperitivo cynar proof x 750 ml.,7791200000619,12499.0,"$12.499,00",20260630
Bebidas,Bebidas,aperitivo cynar x 750 ml.,7791200000626,11199.0,"$11.199,00",20260630
Bebidas,Bebidas,aperitivo dr. lemon gin tonic x 473 ml.,7790950144758,2199.0,"$2.199,00",20260630
Bebidas,Bebidas,aperitivo dr. lemon mojito x 1 lt.,7790950133691,4226.0,"$4.226,00",20260630
Bebidas,Bebidas,aperitivo dr. lemon mojito x 473 ml.,7790950144055,2199.0,"$2.199,00",20260630
Bebidas,Bebidas,aperitivo dr. lemon x 1 lt. red berry,7790950137804,4226.0,"$4.226,00",20260630
Bebidas,Bebidas,aperitivo livenza spritz x 750 ml.,7790950138900,8439.0,"$8.439,00",20260630
Bebidas,Bebidas,aperitivo pimpollal x 750 ml,720665925288,20238.52,"$20.238,52",20260630
Bebidas,Bebidas,aperitivo pineral x 750 ml.,7790950134117,11959.0,"$11.959,00",20260630
Bebidas,Bebidas,aperitivo pronto bitt x 473 ml.,7790950610581,2401.0,"$2.401,00",20260630
Bebidas,Bebidas,aperitivo punt emes x750ml.,7790290007195,11159.0,"$11.159,00",20260630
Bebidas,Bebidas,aperitivo ramazzotti rosato x 750 ml.,7792410779357,11369.0,"$11.369,00",20260630
Bebidas,Bebidas,aquarius cepita sabor pera x 1.5 lts.,7790895640476,3150.0,"$3.150,00",20260630
Bebidas,Bebidas,"aquarius cepita x 2,25 lt. pomelo",7790895003288,3109.0,"$3.109,00",20260630
Bebidas,Bebidas,aquarius cepita x 500 ml. naranja,7790895641213,1763.0,"$1.763,00",20260630
Bebidas,Bebidas,aquarius cepita x 500 ml. pera,7790895640445,1762.0,"$1.762,00",20260630
Bebidas,Bebidas,aquarius cepita x 500 ml. pomelo,7790895640469,1763.0,"$1.763,00",20260630
Bebidas,Bebidas,bacardi x 700 ml carta de oro,7610113025024,20156.0,"$20.156,00",20260630
Bebidas,Bebidas,bacardi x750ml.carta blanca,7501008603017,23717.0,"$23.717,00",20260630
Bebidas,Bebidas,bebida arcor x 200 ml multifruta,7790580150419,631.0,"$631,00",20260630
Bebidas,Bebidas,bebida bc l.camp.x200ml.manzan,7793360106101,707.0,"$707,00",20260630
Bebidas,Bebidas,bebida bc.l.camp.x1lt.multifru,7793360106002,2278.0,"$2.278,00",20260630
Bebidas,Bebidas,bebida hidratante suerox frutilla-kiwi x 630 ml.,7798140257417,2474.0,"$2.474,00",20260630
Bebidas,Bebidas,bebida hidratante suerox x 630 ml. manzana,7798140257424,2474.0,"$2.474,00",20260630
Bebidas,Bebidas,bebida sin alcohol coca cola x 500 ml.,7790895000782,1790.0,"$1.790,00",20260630
Bebidas,Bebidas,bitter smirnoff citric x 700 ml.,7791250003103,11065.0,"$11.065,00",20260630
Bebidas,Bebidas,bitter smirnoff citrus pomelo y lima x 700 ml.,7791250003011,11065.0,"$11.065,00",20260630
Bebidas,Bebidas,bitter smirnoff naranja rubi y lima x 700 ml.,7791250003097,11065.0,"$11.065,00",20260630
Bebidas,Bebidas,cachaca pitu x 1 lt.,7896607100099,13717.0,"$13.717,00",20260630
Bebidas,Bebidas,cepita anana,7790895641732,1380.0,"$1.380,00",20260630
Bebidas,Bebidas,cepita mandarinaanana,7790895649264,2687.0,"$2.687,00",20260630
Bebidas,Bebidas,cepita x 300 ml botella manzana roja,7790895004926,1380.0,"$1.380,00",20260630
Bebidas,Bebidas,cerv.amstel x1lt.ret.lager,7793147573591,4795.0,"$4.795,00",20260630
Bebidas,Bebidas,cerv.budweiser x710ml.,7792798013357,3848.0,"$3.848,00",20260630
Bebidas,Bebidas,cerv.grolsch x925ml.retornable,7793147570842,4159.0,"$4.159,00",20260630
Bebidas,Bebidas,cerv.imperial x710ml.golden,7793147572624,4470.0,"$4.470,00",20260630
Bebidas,Bebidas,cerv.michelob ultra x473cc.,7792798014019,2848.0,"$2.848,00",20260630
Bebidas,Bebidas,cerv.miller x710ml.lata,7793147571382,3569.0,"$3.569,00",20260630
Bebidas,Bebidas,cerv.patagonia x1lt.amber,7792798012961,4700.0,"$4.700,00",20260630
Bebidas,Bebidas,cerv.quilmes 1890 lata x473ml,7792798013951,2100.0,"$2.100,00",20260630
Bebidas,Bebidas,cerv.santa fe x1lt.ret.,7793147573744,4580.0,"$4.580,00",20260630
Bebidas,Bebidas,cerv.stella artois x473ml.lata,7792798010615,3798.0,"$3.798,00",20260630
Bebidas,Bebidas,cerveza amstel lager x 473 ml.,7793147573546,2725.0,"$2.725,00",20260630
Bebidas,Bebidas,cerveza amstel lata x 710 ml lager,7793147572853,3925.0,"$3.925,00",20260630
Bebidas,Bebidas,cerveza andes lata x 473 ml oro,7792798014934,2049.0,"$2.049,00",20260630
Bebidas,Bebidas,cerveza andes original x1lt oro retornable,7792798014972,3409.0,"$3.409,00",20260630
Bebidas,Bebidas,cerveza andes roja lata x 473 ml.,7792798992317,2149.0,"$2.149,00",20260630
Bebidas,Bebidas,cerveza andes roja x 1 lt. retornable,7792798002122,3789.0,"$3.789,00",20260630
Bebidas,Bebidas,cerveza andes rubia origen lata x 710 ml,7792798014156,3109.0,"$3.109,00",20260630
Bebidas,Bebidas,cerveza andes rubia x1 lt. retornable,7792798002115,3409.0,"$3.409,00",20260630
Bebidas,Bebidas,cerveza blue moon belgian white x 473 ml.,7793147573195,4685.0,"$4.685,00",20260630
Bebidas,Bebidas,cerveza blue moon x 355 ml white,7793147574048,5210.0,"$5.210,00",20260630
Bebidas,Bebidas,cerveza brahma chopp x 1 lt. retornable,7792798007493,3399.0,"$3.399,00",20260630
Bebidas,Bebidas,cerveza brahma lata x 354 ml chopp,7792798005871,1199.0,"$1.199,00",20260630
Bebidas,Bebidas,cerveza brahma lata x 473 ml.,7792798005888,1799.0,"$1.799,00",20260630
Bebidas,Bebidas,cerveza brahma x 710 ml,7792798015061,2749.0,"$2.749,00",20260630
Bebidas,Bebidas,cerveza budweiser lata x 473 ml,7793147118822,2482.0,"$2.482,00",20260630
Bebidas,Bebidas,cerveza budweiser x 1 lt. retornable,7793147001056,4200.0,"$4.200,00",20260630
Bebidas,Bebidas,cerveza corona 0 % x 473 ml lata,7792798015351,2449.0,"$2.449,00",20260630
Bebidas,Bebidas,cerveza corona x 473 ml.,7792798014705,3249.0,"$3.249,00",20260630
Bebidas,Bebidas,cerveza corona x 710 ml.,7792798003716,5159.0,"$5.159,00",20260630
Bebidas,Bebidas,cerveza grolsch ipa x 473 ml.,7793147572846,2549.0,"$2.549,00",20260630
Bebidas,Bebidas,cerveza grolsch lata x 473 ml.,7793147570866,2089.0,"$2.089,00",20260630
Bebidas,Bebidas,cerveza heineken lata x 473 cc.,7793147009199,4030.0,"$4.030,00",20260630
Bebidas,Bebidas,cerveza heineken lata x 710 ml.,7793147571283,5995.0,"$5.995,00",20260630
Bebidas,Bebidas,cerveza heineken long neck x 330 cc,7793147009137,4195.0,"$4.195,00",20260630
Bebidas,Bebidas,cerveza heineken x 1 lt. retornable,7793147000899,6865.0,"$6.865,00",20260630
Bebidas,Bebidas,cerveza heineken x 473 ml sin alcohol,7793147574093,3380.0,"$3.380,00",20260630
Bebidas,Bebidas,cerveza iguana x 1 lt. retornable,7793147572211,2879.0,"$2.879,00",20260630
Bebidas,Bebidas,cerveza imperial golden long neck x 330 cc,7793147574109,2149.0,"$2.149,00",20260630
Bebidas,Bebidas,cerveza imperial golden x 1 lt.,7793147573720,5230.0,"$5.230,00",20260630
Bebidas,Bebidas,cerveza imperial golden x 473 ml.,7793147571689,3105.0,"$3.105,00",20260630
Bebidas,Bebidas,cerveza imperial ipa x 473 ml.,7793147570743,3295.0,"$3.295,00",20260630
Bebidas,Bebidas,cerveza imperial lager x 1lt .retornable,7793147573737,4810.0,"$4.810,00",20260630
Bebidas,Bebidas,cerveza imperial lata x 473 ml,7793147000752,2745.0,"$2.745,00",20260630
Bebidas,Bebidas,cerveza imperial lata x 473 ml apa,7793147571160,3295.0,"$3.295,00",20260630
Bebidas,Bebidas,cerveza imperial red ipa x 1 lt. retornable,7793147570330,5670.0,"$5.670,00",20260630
Bebidas,Bebidas,cerveza imperial roja lata x 473 ml,7793147572723,3295.0,"$3.295,00",20260630
Bebidas,Bebidas,cerveza imperial stout lata x 473 ml.,7793147001742,3295.0,"$3.295,00",20260630
Bebidas,Bebidas,cerveza imperial x 473 ml gold cero,7793147574130,2290.0,"$2.290,00",20260630
Bebidas,Bebidas,cerveza imperial x 710 ml.,7793147571412,4005.0,"$4.005,00",20260630
Bebidas,Bebidas,cerveza isenbeck lata x 473 ml,7793147573515,1499.0,"$1.499,00",20260630
Bebidas,Bebidas,cerveza lata patagonia x 473 ml 24.7,7792798001972,3079.0,"$3.079,00",20260630
Bebidas,Bebidas,cerveza michelob ultra botella x 275 ml,7840050009737,2089.0,"$2.089,00",20260630
Bebidas,Bebidas,cerveza miller lata x 473 ml edicion limitada,7793147573386,2409.0,"$2.409,00",20260630
Bebidas,Bebidas,cerveza miller long neck x 330 ml.,7793147573492,2349.0,"$2.349,00",20260630
Bebidas,Bebidas,cerveza miller x 1 litro,7793147570088,4349.0,"$4.349,00",20260630
Bebidas,Bebidas,cerveza miller x 600 ml.,7793147570262,3939.0,"$3.939,00",20260630
Bebidas,Bebidas,cerveza patagonia amber lager lata x 473 ml,7792798001965,3079.0,"$3.079,00",20260630
Bebidas,Bebidas,cerveza patagonia ipa con sauco x 730 ml.,7792798002399,6720.0,"$6.720,00",20260630
Bebidas,Bebidas,cerveza quilmes 1890 rubia x 1 litro,7792798013937,3500.0,"$3.500,00",20260630
Bebidas,Bebidas,cerveza quilmes bajo cero x 1 lt.,7792798013999,3069.0,"$3.069,00",20260630
